"id","comment","photo_id","good","bad","user_id"
1,"sunt impedit laboriosam natus assumenda",7,114,409,6
2,"quod officia est quis",2,674,414,2
3,"esse explicabo at autem tenetur",4,647,971,8
4,"aperiam voluptate sequi laudantium est possimus dolore",9,818,919,6
5,"eos possimus accusantium",8,574,488,6
6,"consequuntur architecto accusamus sequi",6,416,369,4
7,"eveniet animi natus praesentium",8,61,37,6
8,"dicta cum excepturi unde sed",2,978,89,2
9,"magnam nemo modi occaecati veniam",1,327,343,5
10,"eaque recusandae doloremque voluptates autem deserunt veritatis",8,225,224,6
11,"consectetur repellat eligendi officiis odio",2,750,665,2
12,"ad adipisci fugiat",6,894,884,4
13,"ipsum dolore maxime libero explicabo mollitia",6,732,778,4
14,"iusto ea nihil sint molestiae neque perspiciatis",8,893,525,6
15,"incidunt alias tempore",7,797,141,6
16,"molestiae sint ab",7,814,798,6
17,"est ducimus temporibus",1,856,421,5
18,"quidem necessitatibus blanditiis",2,871,267,2
19,"blanditiis cum exercitationem",3,357,674,4
20,"doloribus alias iure",6,802,724,4
21,"ratione cum tempora unde architecto",9,512,465,6
22,"ratione possimus nulla labore eaque nam",9,656,703,6
23,"alias vitae cumque",9,465,384,6
24,"sit debitis iste debitis",4,511,653,8
25,"molestiae rerum dolorem consequatur velit",7,788,56,6
26,"assumenda illo voluptatum quis",2,898,767,2
27,"possimus necessitatibus sunt ipsa",3,543,591,4
28,"maxime ab maiores aperiam consectetur earum",4,379,416,8
29,"accusamus pariatur et",6,673,782,4
30,"omnis modi illo ab",5,562,39,4
31,"atque amet porro adipisci architecto accusamus quo",2,870,143,2
32,"quos quae optio",4,764,365,8
33,"rem id similique harum omnis quidem",1,977,962,5
34,"laborum ipsum facilis soluta quam",3,760,945,4
35,"sint impedit iste quibusdam rem ad",1,427,864,5
36,"aliquam possimus quos fugit necessitatibus numquam",5,137,394,4
37,"temporibus iusto repellendus assumenda",7,915,15,6
38,"culpa earum aperiam sed totam facilis facilis",8,422,526,6
39,"aperiam quibusdam quis amet laborum",6,152,481,4
40,"laborum reprehenderit asperiores facilis sit",7,236,458,6
41,"vitae eveniet sapiente iste",3,849,187,4
42,"quaerat sit molestiae ad eius",4,779,908,8
43,"quisquam similique accusamus fuga",1,105,697,5
44,"quos repudiandae impedit voluptatibus",4,128,181,8
45,"quis doloribus voluptas debitis",6,916,538,4
46,"animi laudantium illum nesciunt nesciunt enim pariatur",1,727,83,5
47,"impedit facilis quas quos quidem nulla",7,639,673,6
48,"iste illo aperiam quis",1,421,997,5
49,"modi perferendis recusandae",7,330,950,6
50,"corrupti recusandae vel sit occaecati",3,344,5,4
51,"recusandae non suscipit provident in quae eaque",1,437,937,5
52,"et optio officia",2,741,164,2
53,"quas minus commodi id voluptatum eum",9,343,788,6
54,"laboriosam aspernatur totam dolor provident dolores",7,413,540,6
55,"nostrum sunt et laboriosam libero totam",3,651,238,4
56,"veniam veritatis quaerat nemo tempora quis tenetur",1,251,907,5
57,"quod necessitatibus quo temporibus excepturi aliquid ex",6,106,513,4
58,"eligendi enim quam perferendis quas eligendi",7,588,573,6
59,"dolorem vel veritatis veritatis",1,647,113,5
60,"in ad doloremque provident cum sunt provident",3,362,963,4
61,"neque quidem eius necessitatibus placeat quibusdam pariatur",7,973,319,6
62,"quaerat fugiat officiis temporibus officiis nisi",1,690,735,5
63,"blanditiis nam accusantium corporis minus",2,451,120,2
64,"aliquid qui placeat",3,346,598,4
65,"corporis impedit et ducimus quae voluptatibus",4,197,558,8
66,"ad eligendi ex possimus amet",4,711,323,8
67,"sit dolore rem animi",9,288,944,6
68,"labore voluptatem aut consequatur",4,591,10,8
69,"eveniet occaecati ducimus earum",6,443,388,4
70,"aperiam perferendis perferendis",7,231,869,6
71,"repellat sed inventore sed",7,260,723,6
72,"voluptatum asperiores neque corrupti nostrum aut molestias",5,894,313,4
73,"quo voluptatem doloribus voluptatem ab",5,713,195,4
74,"exercitationem numquam hic consectetur quia",5,464,751,4
75,"aliquid sed nobis autem quisquam quidem eius",7,835,83,6
76,"tempora laboriosam dicta quis quidem",1,452,663,5
77,"aperiam placeat amet quia eaque",9,633,785,6
78,"fugiat facere corporis hic saepe nihil",3,553,824,4
79,"labore illo natus",9,438,18,6
80,"molestias qui sapiente consequuntur at sapiente ullam",5,841,356,4
81,"sit illum rem rem",6,389,541,4
82,"unde nisi nam ullam ipsum dicta voluptatum",3,372,637,4
83,"modi incidunt sapiente voluptatum hic optio perspiciatis",4,153,361,8
84,"incidunt optio ad et magnam",6,671,349,4
85,"exercitationem quam dolor saepe perspiciatis earum laboriosam",5,643,343,4
86,"voluptates repellendus maxime perspiciatis eos adipisci",4,938,580,8
87,"magnam alias ad ipsam libero",7,45,993,6
88,"optio officia assumenda quod",4,751,960,8
89,"repudiandae aut ducimus",6,892,646,4
90,"eos modi libero animi voluptatibus",3,282,860,4
91,"quaerat consequuntur quae omnis",4,65,914,8
92,"temporibus explicabo accusamus ex incidunt provident ea",6,492,129,4
93,"nisi voluptatum quo consequatur",8,924,16,6
94,"exercitationem ea hic numquam",7,144,406,6
95,"quidem explicabo labore consequatur consequuntur",1,834,270,5
96,"eius rerum autem voluptates voluptas ipsa sunt",7,185,881,6
97,"reprehenderit fugit ducimus quo",1,345,524,5
98,"ea animi vel",9,544,78,6
99,"ex recusandae omnis",3,907,818,4
100,"totam dolorum quod hic vel sequi ratione",6,314,378,4
101,"blanditiis voluptatum iusto",3,21,767,4
102,"earum fuga a non amet",4,380,281,8
103,"enim deleniti quod officiis",3,372,967,4
104,"consequatur nihil odit",6,479,160,4
105,"dolor nostrum neque",7,919,989,6
106,"consequuntur libero eaque",5,627,186,4
107,"sunt laborum quam voluptates quas",6,914,299,4
108,"repellat minus eius quisquam numquam",6,268,220,4
109,"consequatur atque aspernatur quia minus soluta",3,778,953,4
110,"cumque dolor reprehenderit tenetur eos perspiciatis",3,739,531,4
111,"magni corporis similique totam ipsum",7,457,112,6
112,"corporis deserunt quisquam",7,866,637,6
113,"ullam reiciendis sed dolore tempore totam",1,573,627,5
114,"veritatis sed numquam libero voluptas placeat",7,665,537,6
115,"dolorum impedit minima vero quos ab",2,173,545,2
116,"cupiditate hic omnis eos sint maxime",5,667,472,4
117,"natus in ex recusandae consequatur",4,324,335,8
118,"reiciendis earum eius",6,362,101,4
119,"et non consequuntur non voluptas corrupti",5,625,616,4
120,"sunt at dolores nisi aut tempore occaecati",8,188,588,6
121,"blanditiis ipsa soluta facere accusamus veritatis",5,321,730,4
122,"nam cum quae",3,768,783,4
123,"iste a culpa nesciunt",2,744,518,2
124,"natus unde tempora distinctio delectus",3,15,215,4
125,"sit id cupiditate eius odio",2,819,248,2
126,"culpa ipsam deleniti magni",4,754,439,8
127,"labore beatae sit",6,439,335,4
128,"sunt quia exercitationem perferendis officiis voluptates",7,822,669,6
129,"incidunt fugit quos",4,489,445,8
130,"impedit recusandae commodi minima",5,417,275,4
131,"ab sint voluptate",9,874,454,6
132,"fuga quas optio",9,33,433,6
133,"aspernatur corrupti ipsum minima placeat necessitatibus",1,900,262,5
134,"porro veniam occaecati consectetur voluptatem est",2,436,971,2
135,"temporibus vitae asperiores",7,602,199,6
136,"corrupti explicabo inventore nostrum cumque",8,264,386,6
137,"maxime accusamus eum repellendus",8,312,986,6
138,"sed assumenda occaecati neque aut",8,186,751,6
139,"odit dolore blanditiis cupiditate consectetur facilis deleniti",8,874,350,6
140,"unde iure totam",5,751,630,4
141,"temporibus nostrum quidem perspiciatis",1,634,194,5
142,"beatae voluptas vel at amet sint exercitationem",7,735,787,6
143,"magnam veniam veniam tenetur hic nam",7,618,15,6
144,"reiciendis occaecati ut quibusdam pariatur",7,372,569,6
145,"possimus nostrum voluptatibus amet eos tenetur optio",6,773,427,4
146,"maiores magnam eligendi omnis non odit eum",1,717,814,5
147,"quas incidunt occaecati laborum ut",4,577,931,8
148,"veniam nemo quasi facere voluptates nobis dignissimos",7,146,297,6
149,"ipsum dolor odio quisquam",7,61,5,6
150,"dolorum nostrum optio",8,974,895,6
151,"quibusdam voluptatem quisquam tempore dignissimos",2,393,732,2
152,"ut excepturi explicabo",8,575,862,6
153,"soluta sit officiis fugiat",7,921,213,6
154,"dignissimos tempora quaerat accusantium quisquam quisquam",3,809,307,4
155,"non quibusdam qui corrupti sequi ad modi",3,998,551,4
156,"adipisci inventore ad occaecati",2,591,329,2
157,"minima culpa aut nemo minus quibusdam",4,830,879,8
158,"nisi rem corrupti accusantium dolorum dicta veritatis",4,568,302,8
159,"expedita quas quasi impedit nobis dolor voluptatem",7,265,571,6
160,"vel ea perspiciatis perferendis ab similique",5,584,979,4
161,"sit numquam non voluptatem",8,210,855,6
162,"iusto aperiam ratione reiciendis suscipit hic ut",1,335,567,5
163,"sapiente architecto velit cumque sunt vero",1,496,592,5
164,"nihil officiis earum",9,824,429,6
165,"deserunt natus ut ullam illum in",8,767,983,6
166,"nam neque officiis dolore",3,522,954,4
167,"enim laudantium autem a tenetur ab",5,395,160,4
168,"consequatur officia amet",8,50,974,6
169,"iste beatae quo laborum fugiat nisi minus",6,272,580,4
170,"iste voluptates repudiandae cupiditate adipisci maiores",9,47,759,6
171,"esse quas maiores similique",9,220,113,6
172,"totam aut adipisci ducimus",9,214,486,6
173,"odit omnis libero",9,892,246,6
174,"ea quas ipsam quia id ipsam temporibus",9,817,345,6
175,"culpa maiores est fugiat esse ipsum amet",1,617,639,5
176,"ut neque possimus alias quasi",4,581,217,8
177,"reprehenderit ab ad et",3,603,24,4
178,"perspiciatis voluptates officia ex temporibus officia rerum",3,232,276,4
179,"perspiciatis magnam laudantium fugiat nihil officia",3,911,393,4
180,"debitis aliquid repellat quo",4,853,676,8
181,"consequuntur eaque exercitationem",1,456,221,5
182,"quos ad facilis",4,206,604,8
183,"dolorem quos qui tenetur eligendi tempora",1,79,339,5
184,"qui iusto non laboriosam autem unde excepturi",3,509,287,4
185,"voluptas temporibus aliquid quaerat nulla officiis",5,907,52,4
186,"harum expedita hic eius",4,543,725,8
187,"quisquam perferendis magnam dolore",1,672,512,5
188,"perspiciatis dolor aliquid",6,762,639,4
189,"quae repellendus dolor totam assumenda",9,806,25,6
190,"facilis velit unde enim repellat",6,129,376,4
191,"commodi porro alias aliquam eligendi aperiam",3,360,217,4
192,"dignissimos sit laudantium ex nemo delectus nam",2,568,519,2
193,"ipsa debitis velit dolor tenetur",5,686,729,4
194,"debitis animi quaerat cum",4,757,690,8
195,"sequi impedit nesciunt velit molestiae",2,645,872,2
196,"nisi error saepe nemo enim laboriosam sapiente",5,779,713,4
197,"distinctio ullam quod velit",2,219,992,2
198,"maiores quam vel dolorum voluptates assumenda optio",7,192,141,6
199,"distinctio aliquid veritatis vitae vel repellendus",7,216,968,6
200,"ab vero asperiores tenetur inventore quos at",4,5,68,8
201,"reiciendis maxime aspernatur enim odit dolor omnis",9,755,700,6
202,"cupiditate dolorem asperiores dignissimos error necessitatibus",5,440,190,4
203,"rerum provident rem quibusdam ducimus iste impedit",1,367,178,5
204,"voluptates voluptas dolores aspernatur at aliquid fugit",5,450,364,4
205,"dolorem repellat reiciendis tenetur beatae at dolorum",4,183,437,8
206,"modi voluptates temporibus rerum",7,749,127,6
207,"similique rem quod",3,212,559,4
208,"iusto at sed occaecati magnam aut",8,273,665,6
209,"aspernatur et eaque nihil repudiandae eligendi",9,432,247,6
210,"exercitationem provident cupiditate",7,206,938,6
211,"voluptatem quod repudiandae animi",2,72,192,2
212,"quod exercitationem qui",7,573,149,6
213,"reiciendis dolore vitae eum doloremque quod",8,585,423,6
214,"natus blanditiis architecto asperiores modi",1,640,782,5
215,"atque aspernatur debitis quod dolores",1,295,452,5
216,"accusantium voluptates at blanditiis",7,322,158,6
217,"explicabo mollitia quis voluptate non dolorem",8,928,724,6
218,"ratione ducimus animi harum libero dolorem culpa",4,825,904,8
219,"quam impedit libero distinctio",8,39,581,6
220,"quo nulla non nesciunt consequuntur ad cum",7,71,363,6
221,"dignissimos natus quod asperiores cum soluta",8,528,136,6
222,"rerum mollitia veritatis sint quod",1,829,445,5
223,"repellat sed ipsum beatae in",3,746,571,4
224,"natus aliquid odio beatae dignissimos",1,103,571,5
225,"placeat minus quos incidunt ut",5,630,924,4
226,"tempore impedit occaecati",5,908,474,4
227,"provident repellendus cupiditate quidem voluptates dolor",1,99,584,5
228,"eum aperiam corporis quasi recusandae delectus quos",9,950,794,6
229,"repellat porro laborum",7,8,590,6
230,"consequuntur ipsa labore quaerat officiis ipsam excepturi",8,848,329,6
231,"in mollitia ea",9,844,540,6
232,"quas perspiciatis est",9,736,805,6
233,"itaque dolores corporis adipisci incidunt",6,203,478,4
234,"nihil nisi tenetur iure maxime id",4,978,795,8
235,"ipsa totam reprehenderit in magnam quidem dolor",9,616,579,6
236,"libero cumque eum corporis",3,638,954,4
237,"aspernatur nemo quaerat",2,868,484,2
238,"vitae iste atque aliquam",9,336,524,6
239,"facilis eos ex perferendis fugit",7,390,866,6
240,"voluptatem debitis maxime",2,535,358,2
241,"aperiam distinctio commodi voluptatum consequatur",8,53,878,6
242,"provident distinctio praesentium recusandae quos",8,59,224,6
243,"est debitis iure corporis fuga",4,322,6,8
244,"labore laudantium dolore aliquid",3,320,745,4
245,"asperiores dicta a",3,798,236,4
246,"voluptatibus non ea",3,952,129,4
247,"sint quo cupiditate a iste doloribus incidunt",2,45,831,2
248,"aliquid nemo id expedita possimus nihil suscipit",3,842,731,4
249,"commodi placeat voluptatibus quas optio voluptate",3,882,527,4
250,"voluptates cumque doloribus ab quam",8,563,214,6
251,"numquam non ipsam vel atque nisi",8,55,740,6
252,"id nobis nisi rem assumenda quia",4,756,355,8
253,"unde voluptates ex",8,946,536,6
254,"accusantium illum ipsa reprehenderit rerum ad expedita",9,359,970,6
255,"provident unde similique molestiae eaque provident",4,737,893,8
256,"iste neque explicabo dolores",4,877,143,8
257,"blanditiis eaque dolorum odit",3,995,113,4
258,"ipsa nobis aliquid assumenda cumque",8,322,491,6
259,"aliquam earum pariatur itaque fugit illum",8,584,285,6
260,"debitis sit illo",8,83,555,6
261,"quos repudiandae deserunt fugit voluptatibus",5,473,254,4
262,"quas esse corrupti perspiciatis",1,840,264,5
263,"quisquam quos numquam",6,32,379,4
264,"aliquid incidunt quibusdam consequuntur atque",1,104,887,5
265,"unde ipsa officiis nihil nemo",3,955,810,4
266,"sequi dicta incidunt sunt",4,698,728,8
267,"explicabo dolores enim occaecati dolores maiores",7,632,886,6
268,"dolorem soluta reiciendis",4,962,436,8
269,"quas quo minima consequatur explicabo",4,56,156,8
270,"adipisci quos quam delectus",9,515,12,6
271,"deserunt minima nam qui odio qui",2,428,618,2
272,"quo ducimus consequuntur non et debitis hic",5,869,231,4
273,"quae facilis sint praesentium et",3,928,843,4
274,"iusto nemo exercitationem cupiditate maxime",2,619,28,2
275,"doloribus incidunt saepe",8,870,888,6
276,"consequatur consequuntur voluptas vitae deserunt ratione eius",5,913,758,4
277,"commodi et in facilis",8,695,927,6
278,"voluptates deserunt in",3,398,234,4
279,"similique dolore consequatur",8,265,905,6
280,"quasi quasi explicabo",7,596,315,6
281,"nobis inventore illo",2,106,280,2
282,"dicta quas dolorem voluptas",5,999,718,4
283,"doloremque maxime iste harum non eveniet",3,185,297,4
284,"nemo sint iusto culpa in suscipit",8,557,913,6
285,"cumque pariatur repellat",2,5,694,2
286,"perspiciatis omnis alias at",2,20,433,2
287,"maiores quae amet",6,585,209,4
288,"veritatis quaerat omnis voluptates consequuntur non",8,855,145,6
289,"deleniti eligendi vitae quos unde modi",1,31,614,5
290,"eos possimus consectetur reiciendis voluptatibus blanditiis",7,523,255,6
291,"nostrum iste modi doloribus doloremque tenetur",3,331,263,4
292,"quae dignissimos cum deleniti",4,247,368,8
293,"iure fuga ipsa aspernatur cupiditate nulla nihil",1,180,28,5
294,"vel architecto sunt autem numquam voluptatum cupiditate",3,512,476,4
295,"maiores minima impedit tenetur omnis",8,227,103,6
296,"dignissimos dolore magnam a rem at",6,339,462,4
297,"atque recusandae qui ad consequatur ducimus dolorum",3,508,690,4
298,"ab animi ab quae eius facere",5,166,631,4
299,"ex alias eum",3,619,429,4
300,"neque illo quibusdam in laborum qui dignissimos",5,943,880,4
301,"pariatur itaque possimus",2,633,306,2
302,"in dolorum recusandae optio officiis",4,760,280,8
303,"reprehenderit reiciendis nobis repudiandae",7,660,462,6
304,"quas ratione voluptatum unde est soluta",8,844,975,6
305,"culpa quisquam illo",9,792,547,6
306,"voluptas quis minus",8,832,906,6
307,"iusto similique nesciunt alias",7,129,736,6
308,"exercitationem aut odio quasi modi iste voluptate",3,766,5,4
309,"nihil eligendi occaecati",9,795,128,6
310,"officia fugit magnam quis sint explicabo quo",2,202,171,2
311,"porro assumenda officiis eveniet",3,60,316,4
312,"animi illo esse minus dignissimos voluptatum rerum",7,28,312,6
313,"laboriosam commodi perspiciatis quos eaque minus expedita",2,888,947,2
314,"ab qui dolores ullam",3,581,261,4
315,"blanditiis dolorem unde deleniti recusandae fugit",3,424,752,4
316,"repudiandae sequi explicabo nulla assumenda",4,403,379,8
317,"architecto laudantium officia voluptate temporibus sapiente perspiciatis",2,880,81,2
318,"corporis quis perspiciatis",9,40,620,6
319,"est quod asperiores aperiam",7,822,878,6
320,"itaque ipsa quia nesciunt omnis nesciunt",8,547,598,6
321,"iure ex nobis eum iste nam",5,462,401,4
322,"est perferendis aspernatur sunt quod voluptatibus eligendi",6,892,370,4
323,"repellendus totam reiciendis",7,776,766,6
324,"natus sed quidem maiores explicabo aspernatur",5,35,453,4
325,"porro eum recusandae",6,142,732,4
326,"labore cupiditate possimus",3,973,619,4
327,"veritatis corporis nostrum nisi modi esse",5,921,333,4
328,"fugit repudiandae assumenda ullam hic magnam temporibus",6,153,291,4
329,"quaerat ducimus itaque maxime porro necessitatibus",7,841,284,6
330,"dolores fugit mollitia corporis nam minima",6,68,667,4
331,"eius ratione debitis rem doloremque",4,59,565,8
332,"quam itaque aperiam minus quis a voluptatibus",8,214,180,6
333,"deserunt enim officia earum laborum",9,549,924,6
334,"consequatur facilis labore neque animi perspiciatis",5,72,101,4
335,"temporibus ex enim",1,44,203,5
336,"impedit iure explicabo",5,232,417,4
337,"sequi quis iste blanditiis perferendis ab atque",4,893,333,8
338,"rem explicabo fugit sit adipisci neque illum",3,16,94,4
339,"ipsa iste voluptatem fugiat",8,821,944,6
340,"vero repellendus dolorem esse est adipisci",8,72,552,6
341,"ab impedit pariatur non dolores",2,711,289,2
342,"minus deserunt omnis cumque repudiandae",1,812,780,5
343,"voluptatibus debitis tenetur temporibus labore",1,209,826,5
344,"omnis voluptatibus non doloremque aliquam",1,151,907,5
345,"quam minima aperiam beatae",6,751,253,4
346,"deleniti officiis ipsum",3,739,52,4
347,"consequatur nostrum iste eius quisquam laudantium quidem",2,711,234,2
348,"laudantium adipisci dignissimos sint",6,843,227,4
349,"odit error veniam",5,959,333,4
350,"ratione accusamus eius quam exercitationem",3,377,712,4
351,"repellendus ab doloribus totam perferendis quas cum",8,310,587,6
352,"aliquam voluptatem dolorum officiis enim quae",1,307,769,5
353,"ab voluptatum nesciunt quis explicabo nostrum incidunt",7,467,811,6
354,"voluptatibus ipsa reiciendis",2,302,304,2
355,"exercitationem iure magnam harum sed tempora itaque",2,884,87,2
356,"libero eius ex",4,224,508,8
357,"ea sequi explicabo",4,105,217,8
358,"quas dolor voluptates tempora consequatur",7,288,706,6
359,"voluptatem maiores aut eaque magnam aliquam",7,712,738,6
360,"reiciendis sint quia eum quidem ad",3,217,170,4
361,"molestiae atque dolorem ipsa impedit error voluptates",8,488,241,6
362,"voluptatum fuga incidunt",2,271,737,2
363,"aut aliquam dolorum rem nam asperiores",2,159,724,2
364,"voluptate sint illum fugit",6,946,66,4
365,"deserunt est exercitationem molestias distinctio necessitatibus",4,153,12,8
366,"quae ut quis iste voluptas error",6,407,782,4
367,"tempore veniam corporis nisi atque consequatur sunt",7,978,140,6
368,"pariatur quo culpa cupiditate a ad",8,271,118,6
369,"veniam nesciunt vero architecto odit fuga",1,252,502,5
370,"porro animi blanditiis quia unde harum itaque",8,732,596,6
371,"beatae labore rerum unde quod aliquid",3,216,399,4
372,"animi quasi porro eligendi blanditiis distinctio",7,745,408,6
373,"optio dolorum laborum",3,289,899,4
374,"tenetur praesentium alias fugit",1,83,76,5
375,"tempora modi rerum veniam voluptatem quisquam atque",6,179,818,4
376,"placeat nihil eveniet",3,984,50,4
377,"quasi esse blanditiis deleniti corporis sit",5,117,408,4
378,"error cumque quo hic",4,989,930,8
379,"mollitia culpa neque quasi aut iste",6,16,706,4
380,"veritatis recusandae alias",1,540,998,5
381,"molestias necessitatibus ratione molestiae voluptas dolorem repellat",7,10,596,6
382,"quod et neque quibusdam incidunt omnis",4,575,113,8
383,"quaerat iusto quod",1,731,66,5
384,"eius deserunt impedit minus",4,458,389,8
385,"nulla animi doloribus nihil excepturi laboriosam",4,316,862,8
386,"earum laborum inventore unde",5,807,862,4
387,"placeat ipsa vitae",9,526,335,6
388,"harum deleniti ad",2,856,932,2
389,"repellat occaecati dolorum similique earum",4,232,818,8
390,"nisi dolorum est velit provident quas",7,442,707,6
391,"similique suscipit assumenda reprehenderit expedita nisi",6,458,444,4
392,"esse consequatur nam similique",6,229,927,4
393,"molestias optio quos velit earum",9,435,322,6
394,"ad nisi mollitia",8,249,252,6
395,"temporibus dolore possimus placeat aliquid",1,737,342,5
396,"excepturi nulla doloribus",7,295,505,6
397,"molestiae rerum est consectetur velit excepturi voluptates",4,815,743,8
398,"rerum sapiente est quidem explicabo",8,811,61,6
399,"laborum cumque dolorem dolore molestiae esse",9,140,755,6
400,"dignissimos consequuntur rem",2,175,743,2
401,"quae voluptas error libero ad veniam voluptatem",8,533,939,6
402,"tenetur aliquam molestias voluptas a error minus",9,840,651,6
403,"perspiciatis iste sapiente consectetur maiores",6,318,356,4
404,"fuga quis nulla itaque",4,830,296,8
405,"maiores rem cupiditate",9,908,774,6
406,"doloremque tempora quo",9,291,727,6
407,"quas vel totam magni odit reiciendis",2,59,742,2
408,"dolorem assumenda cupiditate dolor ducimus repellendus",6,816,86,4
409,"minima fugiat aut ducimus",2,825,695,2
410,"minus aspernatur corporis dolorem laudantium pariatur velit",2,780,162,2
411,"incidunt quibusdam impedit ea nemo ipsum corporis",8,614,822,6
412,"tenetur quos laboriosam quasi veniam",5,582,665,4
413,"nostrum non ex quas architecto enim nobis",9,602,70,6
414,"aut fugit provident magnam",1,44,491,5
415,"sapiente nobis eos",4,709,356,8
416,"quidem recusandae nam",6,638,907,4
417,"porro accusamus eligendi a sunt vero esse",1,653,973,5
418,"quos magni repudiandae nemo quo omnis",8,571,662,6
419,"fuga harum sit saepe eligendi iure quo",6,202,481,4
420,"fugit laudantium delectus dolor eligendi",5,590,478,4
421,"laudantium exercitationem doloremque nulla veniam doloribus",9,68,460,6
422,"aut iure fuga laudantium eaque pariatur",4,770,351,8
423,"deserunt sed culpa",7,229,628,6
424,"magnam molestias saepe reiciendis dolorem voluptates esse",8,545,851,6
425,"iste aut consequuntur non",2,409,287,2
426,"non ratione earum enim ullam quia",4,40,85,8
427,"neque dicta molestiae ab",1,595,670,5
428,"labore tempora consectetur impedit recusandae expedita",2,597,397,2
429,"consequatur eveniet quidem itaque hic",3,654,243,4
430,"dolorem voluptatum at",9,531,811,6
431,"debitis aspernatur quaerat laudantium",2,116,539,2
432,"sequi architecto ad ipsam",9,808,836,6
433,"consectetur libero sint labore veritatis distinctio",2,765,51,2
434,"optio corrupti quia",6,182,409,4
435,"facilis nihil eaque repudiandae",6,304,282,4
436,"totam earum pariatur saepe accusamus unde",2,625,197,2
437,"voluptatem animi quae",9,806,641,6
438,"velit explicabo odit quis delectus magni omnis",4,397,947,8
439,"sapiente doloremque ab cum recusandae quisquam officiis",4,973,89,8
440,"debitis veniam repudiandae facilis nobis",6,337,71,4
441,"neque necessitatibus quia dignissimos",1,133,121,5
442,"fuga qui expedita",3,103,158,4
443,"earum harum aperiam dolorem exercitationem aut",5,67,975,4
444,"error omnis omnis illum tempore voluptatum",3,664,935,4
445,"possimus voluptas nemo quisquam sint nesciunt",8,486,382,6
446,"ut cum unde nemo",9,956,979,6
447,"debitis cupiditate similique libero ea",6,58,106,4
448,"laudantium non vitae odio minus repellat vero",8,609,856,6
449,"placeat ratione amet eaque",7,343,758,6
450,"corrupti in deserunt provident nostrum esse ipsum",8,944,320,6
451,"numquam quis aspernatur fugiat amet neque magni",6,97,855,4
452,"ullam ex ab fugit aspernatur",5,186,770,4
453,"odit asperiores temporibus at quas nulla nisi",8,294,683,6
454,"dolorum officia voluptatem assumenda cum",6,580,983,4
455,"delectus sequi ut provident eaque ullam",5,778,709,4
456,"non sequi aperiam cum cum omnis fuga",1,16,374,5
457,"dolor adipisci impedit repellendus recusandae animi",4,788,447,8
458,"quibusdam assumenda deleniti velit sunt",5,63,26,4
459,"repellendus impedit alias suscipit",5,386,921,4
460,"voluptas incidunt maxime a aliquid assumenda doloremque",7,360,871,6
461,"autem sapiente esse libero mollitia",3,730,311,4
462,"soluta eius tempora tempore earum",5,840,93,4
463,"tempora excepturi tenetur fuga est quos",9,287,435,6
464,"facilis minima doloremque magni illo placeat hic",9,224,172,6
465,"laboriosam quae sequi architecto",7,860,757,6
466,"delectus architecto nemo debitis libero laboriosam",4,662,307,8
467,"recusandae exercitationem eveniet atque voluptate accusantium maiores",6,170,551,4
468,"enim non sequi velit excepturi",9,452,793,6
469,"dicta ad dolorem repudiandae veritatis",8,364,263,6
470,"perspiciatis illum assumenda inventore omnis placeat in",5,334,370,4
471,"facere exercitationem eum dignissimos veritatis aperiam",4,124,547,8
472,"rem pariatur rem reiciendis",7,976,947,6
473,"corporis dicta sequi dolor",2,774,606,2
474,"aut necessitatibus nobis",9,303,532,6
