"id","comment","photo_id","good","bad","user_id"
475,"voluptatem pariatur enim dolor",1,339,358,5
476,"repellat magni exercitationem doloribus",7,378,602,6
477,"vero eius distinctio quos libero",5,536,836,4
478,"iusto eum iusto magnam",5,905,747,4
479,"non voluptatibus deleniti hic fugit aut quidem",4,561,908,8
480,"quo praesentium eius tempora",9,910,588,6
481,"earum et voluptas autem",3,228,611,4
482,"rem sint officiis",1,604,785,5
483,"asperiores laborum eos consectetur",9,86,977,6
484,"totam quo est recusandae veritatis",3,575,241,4
485,"adipisci vitae qui",3,932,398,4
486,"corrupti repellat velit cumque eligendi",2,234,512,2
487,"hic voluptates hic rem",6,314,326,4
488,"repellendus tempore maiores mollitia voluptas laborum",1,458,50,5
489,"repudiandae ratione hic aperiam eligendi culpa",7,760,190,6
490,"hic expedita facere laudantium et",7,162,471,6
491,"ducimus in mollitia",6,133,531,4
492,"modi debitis adipisci",3,167,186,4
493,"fugit inventore minus veniam",1,989,717,5
494,"quos officiis libero cum architecto et maxime",7,145,505,6
495,"maxime dolorum ratione facilis officia",9,167,804,6
496,"illo aliquid quis itaque consequuntur a",1,818,406,5
497,"commodi voluptas ullam repellendus architecto ab",3,940,593,4
498,"modi explicabo ea",4,985,605,8
499,"praesentium temporibus rerum id beatae occaecati",5,563,297,4
500,"ad accusamus quaerat repellat nam modi",9,627,10,6
501,"harum magni fugit omnis",2,377,494,2
502,"ullam consectetur aliquid",5,552,961,4
503,"sunt facilis consequuntur nam",1,774,663,5
504,"dolor neque aliquam",6,319,439,4
505,"alias cum ut maxime hic distinctio minus",1,264,329,5
506,"inventore consectetur nesciunt nobis similique soluta",3,185,151,4
507,"quaerat repellendus ullam eius impedit ab",2,576,293,2
508,"reprehenderit temporibus explicabo fugiat voluptatem",9,423,527,6
509,"voluptatum aut iste",9,130,144,6
510,"omnis quis expedita",9,523,892,6
511,"officiis similique laudantium",6,194,345,4
512,"error quo beatae magni impedit est soluta",6,910,403,4
513,"voluptate nulla facilis dicta",4,433,842,8
514,"cupiditate asperiores totam perferendis",9,8,674,6
515,"hic excepturi minima dolorem at",3,693,782,4
516,"asperiores voluptates iure",1,723,385,5
517,"repellat dolor fugiat sit veritatis",2,528,525,2
518,"quod voluptatum quaerat suscipit atque",6,577,745,4
519,"quae laudantium officiis officiis sapiente cumque dolores",8,637,23,6
520,"fugiat aperiam ab qui itaque",9,778,740,6
521,"in perspiciatis non",4,353,775,8
522,"expedita odio aspernatur",9,178,169,6
523,"placeat inventore repellendus asperiores sapiente expedita",9,503,367,6
524,"veritatis dignissimos earum ipsam blanditiis",7,865,468,6
525,"error enim soluta debitis",9,388,383,6
526,"ea maiores id",7,175,978,6
527,"quia esse tenetur aperiam provident magni",2,175,576,2
528,"voluptatem voluptatum aperiam in voluptatibus temporibus dolor",9,552,369,6
529,"vel quidem tempora",1,366,386,5
530,"occaecati reprehenderit sint eum illum",5,714,220,4
531,"quaerat vel dolores sapiente",1,871,131,5
532,"ducimus enim velit ut laboriosam natus perspiciatis",3,999,411,4
533,"facilis ab facilis pariatur voluptatem officia similique",7,416,828,6
534,"totam molestias sint",5,625,144,4
535,"fuga ipsam debitis culpa in omnis",7,639,401,6
536,"corrupti exercitationem et itaque labore",9,572,385,6
537,"alias tempore ducimus tenetur accusantium at",9,524,867,6
538,"est exercitationem similique",2,704,37,2
539,"provident illo in nostrum nihil dolor nisi",4,819,192,8
540,"aut ex corrupti asperiores cumque",6,139,34,4
541,"provident dignissimos magni quia quisquam",4,720,868,8
542,"nisi dolores voluptatum",9,930,857,6
543,"cum corporis repellat",8,234,139,6
544,"cupiditate architecto eveniet ut laboriosam",8,968,109,6
545,"illum perferendis ratione voluptate",2,852,960,2
546,"laudantium quae ut nostrum occaecati",6,383,254,4
547,"quidem iusto hic nihil deleniti",4,564,893,8
548,"ea a eveniet culpa optio",6,525,456,4
549,"error ut accusantium beatae deserunt possimus",7,340,80,6
550,"sequi voluptate accusamus occaecati",8,913,403,6
551,"maiores consequatur illum officiis omnis laboriosam",8,431,102,6
552,"corporis modi vero veniam quaerat",3,143,704,4
553,"nesciunt nisi hic qui",5,580,24,4
554,"repudiandae voluptas asperiores aliquam suscipit ex",1,775,301,5
555,"voluptatum dolorem ad dolorum iure enim",8,777,486,6
556,"facere natus totam iusto neque consequuntur voluptatibus",4,723,81,8
557,"perspiciatis a voluptatum nihil quidem omnis",6,373,531,4
558,"eum voluptate dolorem",7,594,779,6
559,"distinctio dolores reiciendis ullam",8,256,781,6
560,"possimus fuga fuga est aspernatur laboriosam",8,344,68,6
561,"rem aspernatur hic",9,720,374,6
562,"illum inventore atque possimus velit autem",8,450,37,6
563,"eos eveniet voluptatum iure consequatur odio",4,708,505,8
564,"velit impedit vitae sapiente rem magni",8,456,242,6
565,"soluta odio ut earum eum",4,740,88,8
566,"possimus provident vero accusamus quo quibusdam vitae",2,825,583,2
567,"delectus doloremque nulla ut quibusdam",8,993,100,6
568,"omnis autem ducimus",4,857,358,8
569,"similique temporibus explicabo",5,922,720,4
570,"porro veniam eos fugit",4,566,823,8
571,"omnis mollitia impedit iste",1,580,527,5
572,"commodi necessitatibus ratione",1,693,381,5
573,"provident ad quidem animi minima eum dicta",7,690,721,6
574,"minus perspiciatis earum mollitia non",5,144,772,4
575,"asperiores repudiandae possimus nobis",6,435,488,4
576,"ratione voluptas quisquam",2,770,607,2
577,"beatae voluptate atque quo",3,727,243,4
578,"ipsum vitae deserunt aliquid cum",7,92,539,6
579,"nam sunt iste odio",8,356,959,6
580,"doloremque rerum quos quasi dolore recusandae voluptatum",3,685,381,4
581,"tempora nobis libero",4,182,501,8
582,"in similique consectetur",1,966,744,5
583,"tempore id impedit",9,286,311,6
584,"quae aut iste esse qui",6,561,565,4
585,"minima expedita error dolores dolorum dolorem tenetur",8,533,814,6
586,"culpa recusandae quia aliquid perferendis ea eos",9,936,977,6
587,"sint laboriosam blanditiis tempora hic fuga",3,322,491,4
588,"quis blanditiis maiores occaecati magnam",6,351,868,4
589,"deserunt cupiditate praesentium",3,360,866,4
590,"dolorum eaque quasi dignissimos",8,485,410,6
591,"voluptate dicta iure",3,251,611,4
592,"temporibus in tempora perspiciatis vero",4,982,132,8
593,"pariatur incidunt quaerat ea ab voluptatem",3,404,569,4
594,"doloremque illum earum ipsam dolor",6,269,825,4
595,"explicabo quos dolorum excepturi officiis",6,934,398,4
596,"occaecati officia odio",6,963,457,4
597,"pariatur magni consequatur",2,38,441,2
598,"optio quidem vel iusto alias culpa",2,434,374,2
599,"in delectus nemo",2,542,782,2
600,"exercitationem dolorem illo",5,775,755,4
601,"inventore quisquam repudiandae eveniet",6,779,346,4
602,"dignissimos beatae porro natus voluptas ipsum maxime",4,451,437,8
603,"minima odio nulla",8,889,609,6
604,"voluptatum veniam commodi",6,58,935,4
605,"ab dolor quo",8,807,849,6
606,"commodi nostrum inventore expedita saepe",4,83,597,8
607,"temporibus voluptatem impedit rem sit nesciunt iusto",7,304,160,6
608,"blanditiis iusto facere",7,602,769,6
609,"quod corrupti labore fugiat nostrum cum magnam",3,891,151,4
610,"laboriosam quibusdam quasi itaque nostrum",9,503,880,6
611,"minus laudantium beatae",8,449,259,6
612,"id voluptatem alias quo culpa natus",7,836,913,6
613,"quae quas rem minus",9,306,175,6
614,"suscipit ipsam similique sapiente fugit aliquid necessitatibus",7,337,916,6
615,"nisi repellat dolor sint voluptatibus nam natus",5,236,46,4
616,"iste optio voluptatum",3,265,255,4
617,"doloribus iure fugiat explicabo",8,381,856,6
618,"maiores eius veritatis voluptatem autem atque",1,371,631,5
619,"modi assumenda optio aliquid sequi enim at",1,277,952,5
620,"minus perferendis ut voluptatibus quia a",7,84,557,6
621,"voluptas temporibus temporibus aperiam pariatur tenetur",1,484,507,5
622,"sequi mollitia ducimus",4,472,411,8
623,"quibusdam est minima corrupti",8,724,72,6
624,"architecto quaerat excepturi quasi maiores omnis",6,252,304,4
625,"saepe officia consectetur ut",4,492,384,8
626,"nisi consequuntur laudantium voluptatem eius quaerat quasi",4,963,296,8
627,"sit repellendus quam sapiente",8,705,352,6
628,"delectus earum non",1,845,663,5
629,"quisquam cupiditate nihil",5,598,295,4
630,"doloribus facere corporis",5,16,828,4
631,"quisquam voluptas rerum",9,612,0,6
632,"illum sunt ut itaque labore aspernatur aliquid",8,259,465,6
633,"omnis repellat ullam recusandae beatae numquam repellat",7,727,111,6
634,"nesciunt placeat earum facere",5,951,616,4
635,"facere nihil aliquam",9,465,126,6
636,"eum consequatur quidem",3,204,989,4
637,"qui iure dicta",8,12,127,6
638,"iste nemo autem",4,380,567,8
639,"assumenda laboriosam rem eaque nostrum quaerat ipsum",5,982,509,4
640,"ipsum nemo totam",2,21,648,2
641,"adipisci explicabo doloremque ducimus consectetur repellendus",1,849,721,5
642,"suscipit ad velit vero ipsum",1,877,280,5
643,"voluptate quia natus voluptatibus repellat optio quisquam",2,85,422,2
644,"delectus porro sit ipsum",1,930,529,5
645,"molestiae libero porro architecto quos",5,612,150,4
646,"qui praesentium placeat",1,173,741,5
647,"temporibus quasi excepturi",4,486,256,8
648,"eligendi ea laborum corrupti fugit incidunt labore",8,668,372,6
649,"reiciendis nostrum facere provident suscipit",1,148,54,5
650,"dolore dignissimos accusantium in",8,996,672,6
651,"minima sunt ab fuga ex dolor",7,801,680,6
652,"autem fugit perferendis labore nulla magnam excepturi",9,563,974,6
653,"excepturi quia aperiam",8,791,144,6
654,"esse libero aliquid mollitia modi",9,282,16,6
655,"placeat maiores doloremque",2,500,504,2
656,"ratione reiciendis nam fugiat fugiat unde sed",9,744,829,6
657,"perferendis nobis nulla",8,205,806,6
658,"doloremque cum ab ipsum dolor dolor iure",9,22,929,6
659,"suscipit aut ipsum explicabo eligendi ad nam",3,435,552,4
660,"tenetur esse necessitatibus repellendus",4,354,689,8
661,"a enim inventore",8,326,793,6
662,"pariatur nostrum odio",3,818,576,4
663,"ullam ex corporis",6,714,601,4
664,"ut vero dolorem",7,70,532,6
665,"unde debitis et omnis",8,255,242,6
666,"est exercitationem repudiandae",5,978,178,4
667,"excepturi beatae ullam porro",4,38,399,8
668,"inventore dolor dolore libero velit culpa unde",5,626,967,4
669,"exercitationem reprehenderit provident commodi odit ex",2,110,798,2
670,"voluptate velit cum reiciendis omnis temporibus",7,790,952,6
671,"dolore facilis dolorem sed maiores optio",1,950,790,5
672,"ullam harum magnam eius a officia ea",3,495,416,4
673,"eligendi placeat natus adipisci voluptate perferendis iste",9,827,457,6
674,"praesentium provident illum labore",5,859,849,4
675,"sapiente libero quia assumenda",4,570,33,8
676,"voluptas exercitationem nostrum doloremque nulla doloremque",1,943,164,5
677,"id molestias aut",4,770,793,8
678,"facere similique in amet occaecati voluptates laudantium",7,213,552,6
679,"libero sint dolorum in animi saepe dignissimos",2,460,412,2
680,"occaecati officia debitis molestias",4,392,356,8
681,"minus voluptatem quisquam tenetur nulla rem voluptatem",6,319,631,4
682,"velit nihil possimus facilis eaque velit quos",4,440,107,8
683,"praesentium recusandae nostrum",6,495,25,4
684,"dolorem ea eos vel",3,530,833,4
685,"nobis quidem occaecati totam",5,490,801,4
686,"quidem repellendus dolores at in qui est",7,826,665,6
687,"corporis explicabo aperiam",4,327,459,8
688,"reprehenderit assumenda harum odit a laudantium",9,974,388,6
689,"neque iusto minus sit corporis",3,863,888,4
690,"totam unde accusamus nesciunt odit qui quis",7,978,105,6
691,"suscipit dolore sunt nemo dignissimos odit",6,188,843,4
692,"quis praesentium neque iste deleniti rem eius",2,217,582,2
693,"impedit tempore saepe accusamus autem exercitationem",7,597,519,6
694,"veniam ratione reiciendis facere aliquam",7,918,118,6
695,"totam nam explicabo quos",1,465,61,5
696,"neque mollitia veritatis vero aliquid",5,940,510,4
697,"cumque hic culpa sit rem corrupti",3,257,168,4
698,"maiores est tempore quos et",1,693,547,5
699,"fugit incidunt eligendi nulla reiciendis unde dolorem",1,563,350,5
700,"harum adipisci nemo nesciunt nobis voluptate",5,80,739,4
701,"ut voluptate odio quibusdam quis ipsam temporibus",7,675,874,6
702,"quibusdam cumque sit error quidem sed",3,993,134,4
703,"ea vel exercitationem iste",3,119,310,4
704,"corporis non perspiciatis vitae soluta reprehenderit suscipit",5,701,476,4
705,"quis atque perspiciatis aliquam cupiditate",5,530,880,4
706,"ipsum molestiae accusamus nam iusto earum exercitationem",4,395,418,8
707,"dolor id rem",3,85,361,4
708,"culpa at nulla iste",1,447,934,5
709,"maxime molestias eveniet reiciendis saepe eaque",6,148,510,4
710,"unde incidunt ad",2,302,208,2
711,"tenetur atque dolor repellendus est autem",6,525,665,4
712,"asperiores omnis illo quibusdam",2,617,64,2
713,"similique est corrupti quibusdam voluptatum",4,47,168,8
714,"tenetur dolorum dolore",4,800,672,8
715,"odio commodi labore sunt doloremque reiciendis",9,921,632,6
716,"ad eligendi quas ut consequatur",8,400,381,6
717,"placeat impedit perferendis maiores",1,658,750,5
718,"delectus laudantium quasi ea quia",4,637,668,8
719,"vel et laudantium",8,716,201,6
720,"omnis molestiae eum molestiae nemo placeat",7,243,369,6
721,"a illum perferendis officia modi",4,845,342,8
722,"quidem vel architecto quaerat adipisci",3,600,171,4
723,"nemo magnam eius nesciunt",9,69,473,6
724,"dolore beatae architecto",5,70,116,4
725,"occaecati numquam necessitatibus architecto temporibus",8,502,486,6
726,"quos mollitia culpa neque reiciendis",3,79,109,4
727,"nostrum adipisci delectus eveniet dolore",1,599,575,5
728,"quibusdam sunt rem optio possimus odit enim",1,704,792,5
729,"fuga omnis illum at asperiores cum",4,904,572,8
730,"doloribus vel doloremque possimus",3,756,682,4
731,"minus distinctio non cupiditate",7,984,445,6
732,"quibusdam dicta earum",1,252,975,5
733,"quae odio sint occaecati autem nostrum",1,633,492,5
734,"eligendi veritatis aperiam et fugiat",1,561,249,5
735,"tempora doloremque molestiae ullam tempore",5,614,415,4
736,"iste eligendi rerum recusandae nam ratione magnam",6,594,844,4
737,"eveniet pariatur ducimus",5,560,314,4
738,"quam possimus ullam vel nesciunt dolorem",1,536,177,5
739,"nam suscipit animi reprehenderit reprehenderit omnis ipsam",2,156,590,2
740,"facilis voluptatem velit mollitia",6,52,116,4
741,"voluptatem id praesentium ut a quam perferendis",5,946,61,4
742,"ut quis quae",1,831,86,5
743,"at voluptatem placeat voluptatum",1,823,501,5
744,"blanditiis quo consequuntur iure",6,476,722,4
745,"veniam aperiam eligendi hic",2,711,775,2
746,"natus provident facere ab",3,625,749,4
747,"reprehenderit beatae aspernatur dolor officia",3,87,68,4
748,"maxime ad corporis facilis maiores officiis placeat",9,182,157,6
749,"voluptatibus eveniet veritatis debitis",2,140,487,2
750,"laudantium fuga reiciendis",4,552,753,8
751,"aspernatur sunt iste vel quia",2,389,468,2
752,"voluptas inventore veniam",9,152,200,6
753,"laborum nam tempora occaecati asperiores nesciunt ea",8,211,642,6
754,"doloremque eveniet delectus saepe esse",8,822,274,6
755,"excepturi quaerat harum culpa",2,875,18,2
756,"reiciendis dolores odit",1,51,589,5
757,"pariatur iure vero vitae qui voluptatibus consequatur",4,805,243,8
758,"nam cupiditate voluptatibus consequatur explicabo quia dolor",4,635,889,8
759,"animi totam recusandae occaecati quo hic ipsa",3,366,45,4
760,"ab doloribus eveniet commodi dolores voluptas minima",7,672,477,6
761,"culpa delectus iste alias occaecati similique voluptatem",7,175,265,6
762,"ipsam dolorem quos",4,167,692,8
763,"in a nihil culpa inventore distinctio fuga",2,345,660,2
764,"laborum quidem recusandae corrupti maiores est repudiandae",7,293,778,6
765,"veniam incidunt voluptatum dolor minima hic",7,166,523,6
766,"velit esse consequuntur neque quisquam culpa laborum",3,752,77,4
767,"fugiat veniam molestias inventore numquam corporis a",6,671,484,4
768,"maiores iure expedita praesentium delectus accusantium dolor",6,624,148,4
769,"ex aliquid sint nostrum explicabo",9,827,283,6
770,"fuga corporis hic quod nulla necessitatibus",8,943,246,6
771,"quam vitae adipisci fugit dolorum cumque eveniet",7,390,579,6
772,"et a veritatis",5,419,321,4
773,"et doloremque magnam",6,633,138,4
774,"quod sed nulla dolorem",8,810,587,6
775,"officiis vitae soluta molestias",1,919,883,5
776,"at laborum eligendi mollitia nemo ratione nulla",7,863,622,6
777,"nisi nobis libero ab",3,479,749,4
778,"culpa enim excepturi pariatur assumenda aliquam",8,771,24,6
779,"quaerat vel nostrum reiciendis occaecati similique",3,213,523,4
780,"nostrum sunt ex",4,484,762,8
781,"aliquid sed consequatur",3,942,992,4
782,"unde non repellendus fugit odit recusandae",4,982,989,8
783,"ipsa nam doloribus",1,569,639,5
784,"rem quos pariatur",5,273,682,4
785,"soluta sed earum sequi",3,280,433,4
786,"voluptatem dolorem voluptas fuga",3,31,411,4
787,"libero illo est omnis",4,638,121,8
788,"unde cumque cupiditate saepe ut eveniet",3,258,162,4
789,"autem quis id",7,213,302,6
790,"eaque et vel at",9,245,476,6
791,"veritatis nihil ipsam sapiente ad",6,686,622,4
792,"quod accusantium excepturi culpa",1,177,288,5
793,"occaecati ad corporis harum at",5,920,454,4
794,"illo rerum optio fugiat corporis",7,45,156,6
795,"commodi nihil earum assumenda recusandae sunt",7,414,850,6
796,"consequatur ad at at blanditiis",1,37,367,5
797,"vero eveniet temporibus deserunt",4,535,562,8
798,"voluptate nam repellat rerum corporis non error",7,310,640,6
799,"aut maiores corporis quidem possimus",3,85,611,4
800,"dolorum repellat amet perspiciatis",7,541,40,6
801,"quisquam possimus necessitatibus odit nemo",7,686,211,6
802,"perferendis autem molestiae illum ex",2,339,295,2
803,"temporibus nam quam dolorum assumenda",5,692,867,4
804,"dolorum assumenda ad ad quia",8,277,502,6
805,"aliquid placeat fugiat repudiandae",1,512,387,5
806,"laudantium dolor nam ullam nisi",8,614,123,6
807,"voluptatem provident occaecati quod illum",8,837,239,6
808,"perferendis reiciendis beatae dolor ut culpa eaque",1,276,856,5
809,"molestiae voluptate quasi praesentium non provident",1,906,402,5
810,"ipsum velit ut est rerum",3,462,52,4
811,"numquam tempora illo aspernatur",5,515,783,4
812,"qui et omnis consequatur consequatur omnis",2,44,760,2
813,"repudiandae facere totam nam rerum",9,707,683,6
814,"tempore dolore veritatis eveniet illo reprehenderit",9,857,49,6
815,"facilis veniam modi",6,87,97,4
816,"eaque cum a nam in",9,217,163,6
817,"vitae ut saepe sed earum molestias",5,845,930,4
818,"qui dolore dolores nemo harum",2,394,716,2
819,"quasi illum magnam iure nam ducimus",9,443,913,6
820,"labore quos voluptatibus aperiam at quam impedit",2,245,126,2
821,"ipsa voluptatibus dolore quisquam totam molestiae",6,223,326,4
822,"delectus quaerat consequatur nostrum",5,914,479,4
823,"et ullam dignissimos exercitationem",4,436,771,8
824,"iusto tempora officia",4,974,524,8
825,"expedita ipsum laborum aspernatur",1,236,123,5
826,"aliquam est asperiores atque ea quae repudiandae",2,157,250,2
827,"sit doloremque totam excepturi debitis nesciunt voluptatibus",9,798,223,6
828,"corrupti debitis commodi sequi perferendis aspernatur",7,494,138,6
829,"sed neque sunt eligendi quos praesentium",5,552,937,4
830,"ea iste dolore",2,292,434,2
831,"necessitatibus earum ex ullam",7,685,982,6
832,"ipsa delectus laudantium vero repellat reiciendis perspiciatis",1,46,913,5
833,"a earum aliquid inventore commodi non magnam",9,967,497,6
834,"possimus omnis nam",4,969,22,8
835,"ea sunt odio natus assumenda corrupti",9,650,949,6
836,"occaecati fugiat ab enim distinctio atque vel",1,692,553,5
837,"illo porro fuga et temporibus sit pariatur",9,804,170,6
838,"voluptas tempore eaque",2,354,256,2
839,"quaerat autem a qui",7,774,994,6
840,"culpa fugiat quia vel",2,839,353,2
841,"alias error ad quo in",9,300,801,6
842,"accusamus sequi iusto",9,212,863,6
843,"atque rem quas labore eius id",9,652,691,6
844,"voluptates pariatur velit facilis",7,341,925,6
845,"quidem dolore sapiente illum impedit amet",1,446,342,5
846,"nisi facilis animi illum eligendi necessitatibus",8,928,309,6
847,"possimus reiciendis soluta a",7,799,805,6
848,"expedita esse accusantium optio",6,147,220,4
849,"temporibus sint beatae eveniet laboriosam explicabo magnam",9,868,802,6
850,"placeat nihil impedit nam",1,491,76,5
851,"doloremque neque doloremque illum porro",9,257,204,6
852,"reiciendis magnam quam molestias",2,912,679,2
853,"tempora deleniti accusamus ipsam consequuntur dolorum",6,529,499,4
854,"quas consequatur nesciunt eum error rem saepe",6,192,935,4
855,"similique neque rem",3,471,51,4
856,"accusamus dicta placeat quas alias soluta",6,172,338,4
857,"ab officia dignissimos repudiandae autem adipisci",9,731,34,6
858,"praesentium quibusdam nesciunt minus fuga esse debitis",4,863,396,8
859,"neque at et rerum itaque voluptas",2,454,189,2
860,"iste odit explicabo odit fugiat sed",8,860,6,6
861,"tempore exercitationem debitis aspernatur ipsam consequatur",2,773,962,2
862,"fugiat repellat laboriosam provident",6,164,166,4
863,"saepe quia excepturi nisi",7,938,61,6
864,"nam ex reiciendis nostrum",3,728,119,4
865,"provident minus fuga",3,793,827,4
866,"quasi cumque omnis vel tempora cumque beatae",4,995,861,8
867,"nam nam blanditiis natus veritatis voluptas",5,639,165,4
868,"est eaque impedit nobis harum nihil",9,0,402,6
869,"nisi ducimus sequi",5,666,77,4
870,"a quibusdam animi dolorem rerum",6,169,313,4
871,"dolorum porro nostrum mollitia inventore",6,336,487,4
872,"nam harum illum maiores impedit recusandae mollitia",6,529,851,4
873,"aliquid earum quo",5,557,536,4
874,"quo ab reprehenderit",3,454,248,4
875,"rerum quo odit",9,408,951,6
876,"sint hic qui",4,321,918,8
877,"delectus dolorum natus odio iure vel",4,631,905,8
878,"dolore labore incidunt porro recusandae ratione suscipit",7,358,386,6
879,"possimus exercitationem et",5,393,90,4
880,"a laboriosam eum veniam consectetur reprehenderit magni",7,322,671,6
881,"tenetur sunt architecto perspiciatis",3,601,665,4
882,"ab nobis magni",2,390,587,2
883,"cumque reiciendis hic",7,237,65,6
884,"recusandae voluptatibus incidunt fugiat doloribus",7,497,488,6
885,"corrupti alias ex est ex unde",3,204,207,4
886,"odio ratione incidunt atque aperiam quia dolores",6,410,737,4
887,"odio ab eligendi blanditiis delectus fuga",4,86,319,8
888,"saepe incidunt laboriosam aspernatur voluptate explicabo",1,100,226,5
889,"molestias cumque quaerat",6,252,976,4
890,"soluta hic reprehenderit neque ipsum deleniti officiis",1,179,861,5
891,"dignissimos sunt debitis aliquam ipsa",9,759,520,6
892,"natus unde aliquam facere",1,210,605,5
893,"possimus accusantium blanditiis",5,413,582,4
894,"recusandae sint quaerat omnis odio pariatur impedit",9,461,32,6
895,"harum eius qui",1,121,80,5
896,"animi quos ea quaerat sapiente",9,375,814,6
897,"inventore voluptatibus deserunt",3,83,127,4
898,"eveniet atque quam quibusdam natus voluptatem laudantium",6,882,471,4
899,"non officia hic velit",8,884,597,6
900,"hic quia facere quis",1,564,581,5
901,"cupiditate unde officia eligendi repudiandae",1,868,965,5
902,"nihil nobis iusto magnam dolorum perspiciatis",3,408,513,4
903,"harum illum doloremque",3,142,257,4
904,"iste cumque quos saepe",5,316,227,4
905,"eos totam maxime nemo sit",4,588,777,8
906,"laboriosam atque molestiae",3,825,755,4
907,"hic iure quo occaecati",5,748,671,4
908,"ut modi dolor",7,927,663,6
909,"praesentium eveniet consequatur officia repellat",9,432,897,6
910,"quis quo nihil hic nam",6,754,212,4
911,"dolores voluptates voluptates",5,37,68,4
912,"sequi maiores provident reprehenderit totam repellendus quia",4,285,879,8
913,"at beatae quasi",9,446,80,6
914,"ducimus est deserunt nulla quaerat aperiam libero",2,947,567,2
915,"temporibus nam repudiandae consequatur laudantium officiis",8,503,845,6
916,"quod odio eveniet distinctio error",7,303,943,6
917,"qui necessitatibus praesentium sint reprehenderit",5,63,877,4
918,"consequuntur cupiditate totam atque",5,788,374,4
919,"iste accusamus dignissimos illum",8,891,515,6
920,"aliquid iusto perspiciatis",3,538,180,4
921,"quia nesciunt ex alias quas nesciunt laborum",2,582,622,2
922,"delectus nisi ipsa perspiciatis",9,470,161,6
923,"maxime numquam laborum neque sunt",3,979,816,4
924,"vel sint neque",8,846,846,6
925,"esse blanditiis vero aspernatur consequuntur unde",1,517,255,5
926,"quidem doloribus illum facilis minus fugiat",1,689,178,5
927,"quas tenetur cupiditate veniam recusandae",6,176,94,4
928,"quo tenetur pariatur",6,765,420,4
929,"corrupti perferendis repellendus optio explicabo",9,910,213,6
930,"dolores vitae quidem",4,854,518,8
931,"voluptatem velit iusto ratione enim",1,54,375,5
932,"similique maxime doloribus",8,904,972,6
933,"ut libero cupiditate necessitatibus aliquam",1,610,850,5
934,"quos laudantium delectus id",3,79,403,4
935,"magnam aperiam a ad",4,770,892,8
936,"neque et perferendis atque eligendi cupiditate quod",6,913,350,4
937,"eveniet modi laborum repellat",5,18,229,4
938,"saepe unde impedit dicta",9,459,389,6
939,"officia dignissimos delectus quod exercitationem",8,603,877,6
940,"aut sint cupiditate sunt recusandae at",6,575,188,4
941,"iure unde inventore",3,999,603,4
942,"deserunt neque voluptatum",9,977,837,6
943,"modi cumque ratione unde nostrum",1,612,346,5
944,"quas pariatur harum expedita quas officia ut",4,31,548,8
945,"quae recusandae fugiat",4,96,632,8
946,"aliquam placeat possimus",3,485,751,4
947,"maiores ipsam laborum",4,747,121,8
948,"quod reprehenderit consequatur maiores exercitationem",7,823,660,6
949,"architecto quia reiciendis reiciendis",1,999,733,5
950,"optio aliquid voluptate voluptas eligendi",2,554,479,2
951,"odit expedita eum blanditiis",6,373,488,4
952,"laudantium doloremque deleniti",5,583,75,4
953,"ex eum velit accusantium",2,527,937,2
954,"adipisci temporibus minima",3,534,210,4
955,"nam occaecati aspernatur nam",7,648,997,6
956,"assumenda aliquid voluptas",8,178,276,6
957,"aliquid saepe tenetur",6,421,791,4
958,"aperiam numquam reiciendis illum dolorum",1,169,495,5
959,"minus officia quis pariatur",7,14,396,6
