"id","comment","photo_id","good","bad","user_id"
960,"aliquid molestias id quod cumque nulla",2,19,62,2
961,"aut ex molestias",7,500,171,6
962,"qui sequi itaque",2,314,657,2
963,"vero officia quisquam reiciendis assumenda consectetur",4,925,966,8
964,"maiores fugit dolore nostrum",3,860,188,4
965,"fugit voluptates ullam in tenetur eaque sapiente",1,533,638,5
966,"reprehenderit ipsam eaque veritatis non vel quibusdam",2,411,648,2
967,"doloremque possimus saepe magnam recusandae",8,140,257,6
968,"veniam id tenetur soluta",5,424,340,4
969,"sint aliquid reprehenderit earum alias consequatur",6,552,811,4
970,"pariatur rerum odit facilis impedit",5,277,68,4
971,"minus nam odit velit",2,964,627,2
972,"facere doloremque nemo ad",1,837,479,5
973,"accusamus reprehenderit recusandae",7,577,140,6
974,"sapiente beatae velit beatae non magni",7,950,261,6
975,"sequi velit officia",2,433,78,2
976,"veniam id nemo ut similique enim",4,253,161,8
977,"amet quas possimus aliquam eligendi tempora magni",5,302,2,4
978,"quisquam omnis inventore quaerat dolorum eligendi",6,327,386,4
979,"repellat error odit praesentium nulla esse nesciunt",2,790,767,2
980,"ipsa nesciunt alias repellat",3,565,425,4
981,"ratione quidem omnis exercitationem",9,490,516,6
982,"maxime vero odio",1,69,522,5
983,"vitae atque a pariatur",1,224,830,5
984,"perspiciatis consequuntur et",1,21,706,5
985,"nulla repellat odit aliquam doloribus soluta",3,207,494,4
986,"quos reiciendis eligendi veniam ipsum deserunt",8,975,728,6
987,"nam animi ad",8,932,654,6
988,"neque doloribus soluta",3,280,633,4
989,"excepturi ab laborum vero",7,511,731,6
990,"magni rem accusantium nisi",1,966,412,5
991,"earum deserunt quas",1,947,35,5
992,"fugit assumenda nulla numquam facere enim",8,360,434,6
993,"libero ex porro quia eveniet sunt",1,654,176,5
994,"enim reiciendis vel aspernatur architecto provident dignissimos",3,489,229,4
995,"deleniti iure illum cupiditate eveniet",2,34,599,2
996,"hic reiciendis nesciunt assumenda ut",4,217,136,8
997,"eaque animi temporibus aliquam nulla natus",7,147,560,6
998,"porro tempore amet doloribus dignissimos cumque quos",9,67,479,6
999,"deserunt nam cumque maiores",4,585,549,8
1000,"incidunt possimus officiis",2,245,254,2